question,answer
What is typhoid fever?,I'm sorry. Perhaps you can seek other avenues to obtain more accurate information.
What are the symptoms of typhoid fever?,"Common symptoms may include Cough, Cholesterol Level, and Fever."
How can I prevent typhoid fever?,"To prevent typhoid fever, it is recommended to no specific information is available."
What medications should I take for typhoid fever?,"Based on user ratings, recommended medications for this condition, sorted by their ratings, are: ( (rated '/10), ( (rated '/10), ( (rated '/10), ( (rated '/10)."
What is ulcerative colitis?,I'm sorry. Perhaps you can seek other avenues to obtain more accurate information.
What are the symptoms of ulcerative colitis?,"Common symptoms may include Cough, Fatigue, and Fever."
How can I prevent ulcerative colitis?,"To prevent ulcerative colitis, it is recommended to no specific information is available."
What medications should I take for ulcerative colitis?,"Based on user ratings, recommended medications for this condition, sorted by their ratings, are: ( (rated '/10), ( (rated '/10), ( (rated '/10), ( (rated '/10), ( (rated '/10), ( (rated '/10), ( (rated '/10)."
